순위,ISBN,상품번호,상품명,판매가,YES포인트,저자,출판사,설명,출고예상일,관리분류
22,9791138920001,123930891,"2024 큰별쌤 최태성의 별별한국사 한국사능력검정시험 심화(1,2,3급) 하","13,950원",770원,최태성 저,이투스북 ,"2024 큰별쌤 최태성의 별별한국사 한국사능력검정시험 심화 하

오랜 연구와 검증으로 한국사에 기초가 전혀 없는 사람도 단기간에 한능검에 합격할 수 있는 최적의 구성을 완성하였습니다. 판서의 장인 큰별쌤 최태성이 핵심만을 모아 만든 아트 판서를 수록하고, 시험에 자주 등장하는 사료, 사진, 지도 등을 모아 해설하여 합격을 위한 필수 개념을 익히기 쉽게 하였습니다. 또한, 한능검 기출문제를 모두 분석한 후, 기출 선택지를 이용한 별 채우기 문제를 수록하여 자연스럽게 기출 선택지가 기억될 수 있도록 하였고, 반복적으로 출제되는 주제의 최신 기출문제를 꼼꼼하고 친절한 해설과 함께 담아 실전에 대비할 수 있도록 하였습니다. 여기에 한국사 연표와 지역의 역사를 담은 지도를 통해 한국사 흐름잡기가 더욱 쉬울 것입니다.

제시된 이미지는 책의 뒷표지입니다.",1,국내도서-수험서 자격증
23,9791191056372,96547408,돈의 심리학 (30만 부 기념 스페셜 에디션) ,"17,820원",990원,모건 하우절 저/이지연 역,인플루엔셜,"가장 크게 성공한 투자자 vs. 가장 크게 파산한 투자자
무엇이 이 둘의 운명을 갈랐는가

‘소설가의 기술을 가진 금융작가’ ‘스토리텔링의 천재’ 
최우수 비즈니스 작가상 수상에 빛나는 모건 하우절의 역작

왜 누군가는 부자가 되고, 왜 누군가는 실패자로 남는가
전 월스트리트저널 기자가 수많은 취재와 연구 끝에 깨달은 부의 비밀

월스트리트저널에서 10년 넘게 금융과 투자에 대한 글을 써온 칼럼니스트이자 콜라보레이티브 펀드 파트너로 활동중인 모건 하우절의 첫 책이다. 출간 즉시 아마존 투자 분야 1위를 차지했고 개인 투자자부터 전문 컨설턴트까지 극찬 세례를 받으며 명실상부 ‘2020 아마존 최고의 금융도서’로 평가받는다.

《돈의 심리학》은 총 20개 스토리로 구성되어 있다. ‘스토리텔링의 천재’ ‘소설가의 기술을 가진 금융 작가’라는 별명답게 모건 하우절이 들려주는 20개의 투자 스토리는 대단히 매력적이다.",1,국내도서-경제 경영
24,9791168270015,104687898,만화로 보는 3분 철학 2,"15,120원",840원,"김재훈,서정욱 공저",카시오페아,"지금까지 이런 철학 만화는 없었다! 철학의 기초 개념을 잡는 가장 쉬운 책!
만화로 3분이면 완벽하게 개념 잡는 서양철학사! 

인문학과 철학의 중요성이 강조되는 시대에 정작 어디부터 공부하면 좋을지 몰라 막막해하는 사람들을 위한 책, 『만화로 보는 3분 철학』 시리즈의 두 번째 권, “중세˙근대편”이 카시오페아에서 출간되었다. 너무 많은 시간을 투자하지 않아도 단번에 철학의 기본 개념을 잡고자 하는 사람들을 위해 어려운 철학을 쉽게 풀어냈다. 만화라는 도구로 접근성은 낮추었지만, 지식의 깊이는 더했다. 

2권에서는 신앙을 학문으로 정비했던 중세 철학자들과 긴 암흑의 시대를 지나 현대 사회의 밑바탕을 그려낸 연 근대 철학자들의 사상을 소개한다. 아우구스티누스, 토마스 아퀴나스, 데카르트, 스피노자, 라이프니츠, 흄, 칸트, 헤겔…. 이름은 한 번쯤 들어본 이들의 사상이 각각 어떻게 다르고 또 어떤 계보로 이어져 오고 있는지 한눈에 파악할 수 있다.",1,국내도서-인문
